<?xml version="1.0" encoding="UTF-8"?>
<sensible xmlns:xsi="http://www.w3.org/2001/XMLSchema-instance"
          xsi:noNamespaceSchemaLocation="sensible.xsd">
    <project name="deors.tools"
             basePackage="deors.tools.filemanager">
        <object name="DateShifter"
                frameTitle="deors date shifter"
                frameAbout="About deors date shifter 1.0\nThis tool is part of deors file tools suite\nAuthor: deors\n\u00a9 deors 2009-2011"
                log="true">
            <field name="shift" description="Time shift"
                   type="SensibleTime" required="true"/>
            <field name="rootDir" description="Root Directory"
                   type="SensibleString" required="true" maxLength="256"/>
            <field name="recurse" description="Recurse subdirectories"
                   type="SensibleBoolean" flag="true"/>
            <field name="applyToFiles" description="Apply to files"
                   type="SensibleBoolean" flag="true"/>
            <field name="applyToDirectories" description="Apply to directories"
                   type="SensibleBoolean" flag="true"/>
            <field name="filter" description="Filter files"
                   type="SensibleBoolean" flag="false"/>
            <field name="filterRegex" description="Filter expression"
                   type="SensibleString" maxLength="128"/>
        </object>
    </project>
</sensible>
