<?xml version="1.0" encoding="UTF-8"?>
<sensible xmlns:xsi="http://www.w3.org/2001/XMLSchema-instance"
          xsi:noNamespaceSchemaLocation="sensible.xsd">
    <project name="deors.tools"
             basePackage="deors.tools.media">
        <object name="JPEGSorterAndRenamer"
                frameTitle="deors jpeg sorter and renamer"
                frameAbout="About deors jpeg sorter and renamer 1.0\nThis tool is part of deors media tools suite\nAuthor: deors\n\u00a9 deors 2009-2011"
                log="true">
            <field name="rootDir" description="Root Directory"
                   type="SensibleString" required="true" maxLength="256"/>
            <field name="name" description="Picture name"
                   type="SensibleString" required="true" maxLength="64"/>
            <field name="offset" description="Offset"
                   type="SensibleInteger" required="false" minValue="0" maxValue="999"/>
            <field name="sort" description="Sort files by shot date"
                   type="SensibleBoolean" flag="true"/>
            <field name="rename" description="Rename files"
                   type="SensibleBoolean" flag="true"/>
            <field name="update" description="Update modified date"
                   type="SensibleBoolean" flag="true"/>
            <field name="test" description="Test only"
                   type="SensibleBoolean" flag="false"/>
            <field name="recurse" description="Recurse subdirectories"
                   type="SensibleBoolean" flag="false"/>
            <field name="filter" description="Filter files"
                   type="SensibleBoolean" flag="false"/>
            <field name="filterRegex" description="Filter expression"
                   type="SensibleString" maxLength="128"/>
        </object>
    </project>
</sensible>
